{
  "$schema": "https://json-schema.org/draft/2020-12/schema",
  "$id": "urn:leviathan:stairstepper:repository-ruleset-create",
  "title": "CreateRepositoryRuleset W6 profile",
  "description": "Request-body shape for POST /repos/{owner}/{repo}/rulesets, limited to the rule types W6 emits. Field names and required parameters follow GitHub REST 'Create a repository ruleset' (docs read 2026-10-17). This file is not the full GitHub OpenAPI document.",
  "type": "object",
  "additionalProperties": false,
  "required": ["name", "target", "enforcement", "conditions", "rules"],
  "properties": {
    "name": {
      "type": "string",
      "minLength": 1
    },
    "target": {
      "type": "string",
      "enum": ["branch", "tag", "push"]
    },
    "enforcement": {
      "type": "string",
      "enum": ["disabled", "active", "evaluate"]
    },
    "bypass_actors": {
      "type": "array",
      "items": {
        "type": "object",
        "additionalProperties": false,
        "required": ["actor_type"],
        "properties": {
          "actor_id": {
            "type": ["integer", "null"]
          },
          "actor_type": {
            "type": "string",
            "enum": ["Integration", "OrganizationAdmin", "RepositoryRole", "Team", "DeployKey", "User"]
          },
          "bypass_mode": {
            "type": "string",
            "enum": ["always", "pull_request", "exempt"]
          }
        }
      }
    },
    "conditions": {
      "type": "object",
      "additionalProperties": false,
      "required": ["ref_name"],
      "properties": {
        "ref_name": {
          "type": "object",
          "additionalProperties": false,
          "required": ["include", "exclude"],
          "properties": {
            "include": {
              "type": "array",
              "minItems": 1,
              "items": {
                "type": "string",
                "minLength": 1
              }
            },
            "exclude": {
              "type": "array",
              "items": {
                "type": "string"
              }
            }
          }
        }
      }
    },
    "rules": {
      "type": "array",
      "minItems": 1,
      "items": {
        "$ref": "#/$defs/rule"
      }
    }
  },
  "$defs": {
    "rule": {
      "oneOf": [
        {"$ref": "#/$defs/deletion"},
        {"$ref": "#/$defs/non_fast_forward"},
        {"$ref": "#/$defs/pull_request"},
        {"$ref": "#/$defs/required_status_checks"}
      ]
    },
    "deletion": {
      "type": "object",
      "additionalProperties": false,
      "required": ["type"],
      "properties": {
        "type": {"const": "deletion"}
      }
    },
    "non_fast_forward": {
      "type": "object",
      "additionalProperties": false,
      "required": ["type"],
      "properties": {
        "type": {"const": "non_fast_forward"}
      }
    },
    "pull_request": {
      "type": "object",
      "additionalProperties": false,
      "required": ["type", "parameters"],
      "properties": {
        "type": {"const": "pull_request"},
        "parameters": {
          "type": "object",
          "additionalProperties": false,
          "required": [
            "dismiss_stale_reviews_on_push",
            "require_code_owner_review",
            "require_last_push_approval",
            "required_approving_review_count",
            "required_review_thread_resolution"
          ],
          "properties": {
            "allowed_merge_methods": {
              "type": "array",
              "items": {"enum": ["merge", "squash", "rebase"]}
            },
            "dismiss_stale_reviews_on_push": {"type": "boolean"},
            "require_code_owner_review": {"type": "boolean"},
            "require_last_push_approval": {"type": "boolean"},
            "required_approving_review_count": {"type": "integer", "minimum": 0},
            "required_review_thread_resolution": {"type": "boolean"}
          }
        }
      }
    },
    "required_status_checks": {
      "type": "object",
      "additionalProperties": false,
      "required": ["type", "parameters"],
      "properties": {
        "type": {"const": "required_status_checks"},
        "parameters": {
          "type": "object",
          "additionalProperties": false,
          "required": ["required_status_checks", "strict_required_status_checks_policy"],
          "properties": {
            "do_not_enforce_on_create": {"type": "boolean"},
            "strict_required_status_checks_policy": {"type": "boolean"},
            "required_status_checks": {
              "type": "array",
              "minItems": 1,
              "items": {
                "type": "object",
                "additionalProperties": false,
                "required": ["context"],
                "properties": {
                  "context": {"type": "string", "minLength": 1},
                  "integration_id": {"type": "integer", "minimum": 1}
                }
              }
            }
          }
        }
      }
    }
  }
}
