{
  "name": "w6-default-branch",
  "target": "branch",
  "enforcement": "active",
  "bypass_actors": [],
  "conditions": {
    "ref_name": {
      "include": [
        "refs/heads/feat/jev-fact-kernel"
      ],
      "exclude": []
    }
  },
  "rules": [
    {
      "type": "deletion"
    },
    {
      "type": "non_fast_forward"
    },
    {
      "type": "pull_request",
      "parameters": {
        "dismiss_stale_reviews_on_push": false,
        "require_code_owner_review": false,
        "require_last_push_approval": false,
        "required_approving_review_count": 0,
        "required_review_thread_resolution": false
      }
    },
    {
      "type": "required_status_checks",
      "parameters": {
        "do_not_enforce_on_create": false,
        "strict_required_status_checks_policy": true,
        "required_status_checks": [
          {
            "context": "CI / CI"
          },
          {
            "context": "CI / L1"
          }
        ]
      }
    }
  ]
}
